{
  "name": "maina",
  "displayName": "Maina",
  "version": "1.8.1",
  "description": "Verification-first guardrails for AI coding agents: gates risky actions, verifies changes and reviews diffs before they merge.",
  "author": {
    "name": "Maina",
    "url": "https://mainahq.com/"
  },
  "homepage": "https://mainahq.com/",
  "repository": "https://github.com/mainahq/maina",
  "license": "Apache-2.0",
  "keywords": [
    "verification",
    "guardrails",
    "code-review",
    "mcp",
    "tdd"
  ]
}
